WeekOf,OverallRating,Comments,FeedbackCategory
9/1/2022,Neutral,"My daughter receives flyers at school and I receive emails from Scholastic , After she showed me her choices on the flyer that she received at school, I opened up my most recent email and tried shopping there.  Book titles and item numbers listed on the flyer were not on the Scholastic page that I got through my emails, and book titles were unable to be located. I eventually went to scholastic.com/bookclubs and I was able to use titles/item numbers but it would be much more user-friendly if all of these products were available on all scholastic sites.",Website Filter/Search Options
9/1/2022,Very Satisfied,Haven't placed my order yet the survey popped up lol,Interrupted by Survey Pop-up
9/1/2022,Very Satisfied,"I originally couldn't find the same books from my child's Scholastic flyer on the site, then I found the Book Club section.",Website Performance/Navigation
9/1/2022,Satisfied,My other student's teacher didn't seem to have an account.,Connecting Teacher/Class Code
9/1/2022,Neutral,Love the $1 books!!! A great way to build our library without breaking the bank!! Thank you for those!!,Thanks/Praise
9/1/2022,Neutral,"I tried to reach out about the Reads promotion code not working and never got a response. I have placed my order- which is over $25 dollars- but when I would enter in the reads code it would say coupon is expired, but the promotion is still being advertised. How can I redeem for my free book?",Bonus Points/Rewards/Promos
9/1/2022,Satisfied,"It was difficult to find the correct website for my child's classroom order. The teacher had provided the website of 'scholastic.com' which did not have an obvious spot to put the classroom code, so I ended up just googling.",Connecting Teacher/Class Code
9/1/2022,Very Satisfied,Initially tried to get on the site via my phone and was having difficulties so I switched to a computer and everything worked great.,Website Mobile Compatibility
9/1/2022,Satisfied,So far it's been easy to navigate. This is the first time I am ordering them online.,Thanks/Praise
9/1/2022,Neutral,"I was frustrated by the fact that there was no way to see my cart without creating an account. Each of the paper catalogs have some overlap in titles, and I wanted to check if I had already added a title. The fact that there is no guest mode was a major deterrent. I will use the service to support my child's teacher, but I will not be placing the order online.",All Other
9/1/2022,Neutral,VERY limited suggestions when using book finder.,Products Offered/Availability
9/1/2022,Satisfied,I can't see where to set my due date for book order.,Website Performance/Navigation
9/1/2022,Satisfied,trying to introduce new teachers to scholastic and had trouble accessing information.,Website Performance/Navigation
9/1/2022,Very Satisfied,"Most of the books in my classroom library that are read the most, I have gotten through Scholastic.",Thanks/Praise
9/1/2022,Satisfied,"to make a purchase we must register first, I did not know that, so it was a bit difficult for me",All Other
9/1/2022,Disappointed,"As Bookkeeper, I am attempting to obtain an invoice to pay the purchase order. Schools are tax exempt I have submitted our tax exempt certificate multiple times. I do not understand how a company that services schools makes it so difficult to use the purchase order system and receive an invoice (in order to pay the balance) that is tax exempt.",Account Balance/Payment
9/1/2022,Very Satisfied,I had a flyer from the school so being able to just enter the codes from the flyer made this process quick and easy!   Great deals on good books!,Thanks/Praise
9/1/2022,Very Satisfied,I just got to the website so I havent done anything yet.,Intend to Order in Future
9/1/2022,Very Satisfied,"I APPRECIATE PAYPAL BEING AN OPTION AT CHECKOUT.  MADE IT A BREEZE TO CHECKOUT AND NOT HAVE TO PUT CARD INFORMATION ON YET ANOTHER WEBSITE.  ALSO I LIKE THE REVIEWS PEOPLE GIVE ON THE BOOKS,  AND THE PREVIEW ONLINE THAT IS NOT AVAILABLE IN THE FLYERS! WILL PLAN ON USING THE ONLINE ORDER FORM FOR BOOKS AGAIN.  THANK YOU!",Thanks/Praise
9/1/2022,Satisfied,"I really love using scholastic. However, I was very nervous to use again becuase last school year I had so many issues with ordering and shipping. It was very unorganzied and no one was really willing to help me. I am hoping my experience this year is better.",Hopeful Shipping Improves this Year
9/1/2022,Very Satisfied,I have 2 kids. I selected both kids but was only able to get 1 free book with code. I hope both teachers get credit for books ordered for that child.,Bonus Points/Rewards/Promos
9/1/2022,Very Satisfied,"Love how easy it is to connect my account with my child’s teacher, the paper flyers rarely make it home!",Thanks/Praise
9/1/2022,Very Satisfied,"My name is Ivy Smith.A teacher at Hudsonk8 School. School:Bertram A.Hudson.3300-F.Shuttieworth Drive,Birmingham,Al  35207  I am a Third Grade Teacher.I need  code to order my  students book. There are three third grade teacher.Thanks so much.",All Other
9/1/2022,Satisfied,It took me forever to log on,Website Performance/Navigation
9/1/2022,Neutral,Just browsing. Will look again later.,Intend to Order in Future
9/1/2022,Very Disappointed,It's too confusing to locate how to link an order to a teacher code. There needs to be a more obvious/seamless way to do so.,Connecting Teacher/Class Code
9/1/2022,Disappointed,"Not user friendly. Very clunky on mobile. I said yes to survey & brought me here immediately. It was supposed to wait until after my visit was done, right?",Interrupted by Survey Pop-up
9/1/2022,Very Satisfied,"I am NOT getting the book club flyers for some reason....I teach second grade but would like to get first, second and third flyers if possible.    Thank you  Sarah Cox  5666 E. 81 St  Tulsa ok 74137",Kits
9/1/2022,Satisfied,Trying to find books that would interest my child,Products Offered/Availability
9/1/2022,Very Satisfied,Love this site! It’s super easy to use and I love that it gives you the age range for each book! It makes it much easier to pick books for my kids!,Thanks/Praise
9/1/2022,Satisfied,"I understand that things are more expensive across the board today - but it is sad that book prices are increasing so much that it is getting more difficult to provide fun new books for my class.  The school library budget is almost nonexistent and I try to keep the newest books in my room and as we use/love the books into disrepair, I like to replace so we have nice books to read.  I love to give books as gifts at Christmas and end of year so I hope that the $10 for 10 packages will still be available.",Price
9/1/2022,Neutral,Once you sign out the first time it’s very hard to get back.,Website Performance/Navigation
9/1/2022,Satisfied,Can you please send me paper copy of the flyer for my students,Kits
9/1/2022,Very Satisfied,Excellent site.,Thanks/Praise
9/1/2022,Satisfied,Website is lagging,Website Performance/Navigation
9/1/2022,Disappointed,I had a hard time finding value packs like last year.,Website Filter/Search Options
9/1/2022,Satisfied,It would be a nice option to have books sent home so they can be a gift.,Ship to Home
9/1/2022,Satisfied,I love Scholastic! It may be nice if you all sent less emails. As a teacher we receive tons of emails daily from our site and district. Please take that into consideration.,Thanks/Praise
9/1/2022,Neutral,Such a wonderful selection of books. Thank you,Thanks/Praise
9/1/2022,Neutral,Adding to car could be easier instead of having to click on the book. I'd like to be able to add it from the search pages. Takes less time.,Website Performance/Navigation
9/1/2022,Neutral,Could not scroll to click submit button. Had to turn phone sideways and try to find the button.,Website Mobile Compatibility
9/1/2022,Disappointed,It is very hard to find the ewallet information on how to check balance,Account Balance/Payment
9/1/2022,Satisfied,I haven't submitted an order yet,Intend to Order in Future
9/1/2022,Neutral,The survey came up before I got to order,Interrupted by Survey Pop-up
9/8/2022,Neutral,"I'd like to be able to sort by book format, ie, hard cover vs. paperback, as a first sort, and then filter down by author, category of interest or any other option.",Website Filter/Search Options
9/8/2022,Neutral,Printing is very small making it difficult to read,Website Performance/Navigation
9/8/2022,Very Satisfied,"So easy to place your order especially if you have the item numbers ready. However, I didn't see the box to order my free book and my order is above $50. Please contact me. Thank you.",Bonus Points/Rewards/Promos
9/8/2022,Satisfied,"Was not able to order desired item due to low quantities.  Daniel (Scholastic rep) checked and said Scholastic was out of ""Who Would Win?"" Ultimate Rumble 6 pack 40C1 and when I asked if I could pre-pay he checked and said it was doubtful there would be more coming in.",Products Offered/Availability
9/8/2022,Very Satisfied,We love the variety and cost of books offered.  We love being able to earn bonus points too!,Thanks/Praise
9/8/2022,Very Disappointed,"Created an ewallet and added funds for book fair, clicked the link to print it and it gave me a blank page. No way to get back to the ewallet page after that and no mention of it in our account. Called and spoke to a rep that confirmed the ewallet was created and the funds from our scholastic gift card were applied, still nothing showing on the site under our account or any scholastic page I can find. Sent my 8 year old to school crying because he doesn’t think he will be able to buy anything without the paper with a barcode on it.",Account Balance/Payment
9/8/2022,Very Satisfied,I would like for you to bring back the dollar books.,Price
9/8/2022,Neutral,Bouncing between parent purchases and purchases that support teachers.,"Unfamiliar with Different Sites (BC, SSO, TSO etc)"
9/8/2022,Neutral,I've loved Scholastic since I was a child and now I get the joy of sharing the love of reading with my child. You always have affordable prices so I know I can at the very least buy one or two books without breaking the bank! Thanks for all that you do!,Thanks/Praise
9/8/2022,Satisfied,"Sometime I click on an email regarding information or a promotion, but once I sign in I cant find it,",Bonus Points/Rewards/Promos
9/8/2022,Satisfied,"AS an educator I am always happy with the ease of ordering . I am happy to see that the teacher incentives in technology have improved, since they were taken away last year.",Thanks/Praise
9/8/2022,Disappointed,Was to get a free book for an order of 25 or more. Added the free book of choice but it is not showing up on the order.,Bonus Points/Rewards/Promos
9/8/2022,Neutral,"Also, I have always struggled with which site to go to. If I go directly to scholastics.com, I cannot find my way to this and it is very confusing. I do not like it.","Unfamiliar with Different Sites (BC, SSO, TSO etc)"
9/8/2022,Very Satisfied,"Would like to see a bigger collection of popular books. But other than that, everything was great.",Products Offered/Availability
9/8/2022,Very Satisfied,Many of my students ordered books this month.  The deals were good!,Thanks/Praise
9/8/2022,Neutral,"Bonus point display on order play is not obvious. I had to go to my account to see bonus points. On order page, it appears to me, I have no bonus points. On my teacher page, it indicates 466 bonus points. Confusing!",Bonus Points/Rewards/Promos
9/8/2022,Satisfied,Some of the codes of the books in the flyers did not match when entering the codes online. But looking at the titles I found the books.  I Will place my order tomorrow.,Website Filter/Search Options
9/8/2022,Very Satisfied,I'm glad to be able to use Scholastic Book Clubs this year!,Thanks/Praise
9/8/2022,Satisfied,unable to use promo codes that I could've used on scholastic's main website,Bonus Points/Rewards/Promos
9/8/2022,Satisfied,"I wish there was always an option for a $1 book. I would order one for each of my children every month, in addition to whatever they had picked out.",Price
9/8/2022,Disappointed,"I have an order I am still waiting on. I placed the order on 8/28 and the status of my order still says acceptance pending.  My order number is ORDER #69779993.   I love Scholastic and so do my students, but the shipping issue is making me reconsider using this in the future.",Delayed Shipping/Delivery
9/8/2022,Neutral,I used live chat. The representative found I had a duplicate acct which was why I couldn't see the teacher stuff I needed.,Website Performance/Navigation
9/8/2022,Satisfied,Too many pop-ups,Website Performance/Navigation
9/8/2022,Satisfied,Choosing the $10 free books was too difficult. Unless you already know an item you want.,Bonus Points/Rewards/Promos
9/8/2022,Disappointed,Difficult to get through,Website Performance/Navigation
9/8/2022,Satisfied,it is frustrating that i am unable to view pricing prior to connecting to a teacher,Connecting Teacher/Class Code
9/8/2022,Very Satisfied,Different times when placing an order I have tried to search for a specific book title and am unable to find it.  I have used both the title and a number that I have seen listed as being the specific book.  Without searching through all the titles how do I find it?  When doing my order tonight I was searching for the book titled … The Day I Forgot To Wash My Hands.  I again was unable to find it.,Products Offered/Availability
9/8/2022,Neutral,the site is a bit difficult to navigate,Website Performance/Navigation
9/8/2022,Very Satisfied,I will place my order next week (2 week timeline for my students),Intend to Order in Future
9/8/2022,Very Satisfied,I think I get more excited than my child about book orders. Scholastic always has great choices and our home library is bursting at the seams!,Thanks/Praise
9/8/2022,Neutral,"It has a pop-up that says to enter code READS for a free book with a $25 order, but when I enter that on the checkout page, it tells me the code has expired.",Bonus Points/Rewards/Promos
9/8/2022,Neutral,"I was looking forward to getting the Biscuit book collection, my son has one and loves them. These are hard to find in stores.",Products Offered/Availability
9/8/2022,Very Disappointed,WHY IS THE PLUSH UNICORN NOT AVAILABLE FOR SHIPPING TO THE HOME?????,Ship to Home
9/8/2022,Very Satisfied,need an app this titles look pretty good,All Other
9/8/2022,Very Disappointed,I have been trying to order books all evening and they will not add to my cart for purchase. This is very frustrating as we were supposed to have through today (9/12) to order.  I would like to still place my order but do not know how to do so.,Website Performance/Navigation
9/8/2022,Satisfied,Did not complete today because I need to call customer service to see if I can order more.  I want to give one to each of our 150 students,Products Offered/Availability
9/8/2022,Satisfied,"When I first tried to access the book, it would not load.  I logged back in",Website Performance/Navigation
9/8/2022,Very Satisfied,SMA order,All Other
9/8/2022,Disappointed,the instructions we were given to order a book was NOT how it was presented on the site.  should not be that difficult to order a $2 book!,Website Performance/Navigation
9/8/2022,Very Satisfied,I appreciate the $1 books so I can purchase books to give to my students each month.,Thanks/Praise
9/8/2022,Satisfied,Hard to understand the free book up to $5. I wasn't sure if it would be be a discount of $5 for the total order (I was interested in a $7 book to put towards the $5 free) or if I had to choose a book that was $5 or under,Bonus Points/Rewards/Promos
9/8/2022,Satisfied,"Logging in was difficult, I had to use the live chat today for assistance and change my password",Website Performance/Navigation
9/8/2022,Satisfied,Since parents submitted orders after I placed my initial order I didn't understand how the book points work- if I would still get bonus point. It looks like I do so I am pleased with that.,Bonus Points/Rewards/Promos
9/8/2022,Satisfied,I was trying to set up and edit my online letter and could not close out,Website Performance/Navigation
9/8/2022,Neutral,"Great selection of books, website each to navigate.",Products Offered/Availability
9/8/2022,Neutral,Trying to pay with check and credit card.,Account Balance/Payment
9/8/2022,Neutral,I was confused on how to collect my free books. I tried to use 575 bonus and I have over 8000 but I was told I didn't have enough points.,Bonus Points/Rewards/Promos
9/8/2022,Satisfied,I absolutely love Scholastic Book Orders! Great selection and pretty good prices!,Thanks/Praise
9/8/2022,Very Satisfied,Easy site to use.,Thanks/Praise
9/8/2022,Very Satisfied,Easy to maneuver.,Thanks/Praise
9/8/2022,Satisfied,Tried to complete on the mobile site but was unable to tap the 'Confirm & Apply' button after selecting the free book so had to switch to laptop/desktop view to complete the order,Website Performance/Navigation
9/8/2022,Satisfied,Thank you for shipping faster!,Thanks/Praise
9/8/2022,Neutral,"I received an email for the third time this month that says ACTION REQUIRED A student has ordered online and you must submit it now....  I notice when I submit each order I do not receive BONuS points. Each order has been over $20, but I just get 20 bonus points. Why don't you combine all of mine for each month and I can receive the EXTRA bonus points?  An order of $60 triples my amount of BPs! How can I get the maximum amount?",Bonus Points/Rewards/Promos
9/8/2022,Very Satisfied,Scholastic is a great company! My class loves to read. I'm hoping many of them will order books this year.,Thanks/Praise
9/8/2022,Very Disappointed,"Every time I attempt to use this site I feel massively frustrated. As a parent, there are multiple sites you can (attempt to) order from, and I went through the whole process of filling up a cart before realizing it was the wrong site. It's really inefficient that I can't connect to a bookclub at checkout. I do this every school year first thing, and then I tend to give up ordering because it pisses me off so much.","Unfamiliar with Different Sites (BC, SSO, TSO etc)"
9/8/2022,Neutral,It would be nice to be able to search under subject/interests and get more than like 8 choices.,Website Filter/Search Options
9/8/2022,Neutral,I also hesitate to order from scholastic because the last few times it took like 3 months for the money to be processed and get my books. It's really irritating. I only tried again to help support our teacher.,Hopeful Shipping Improves this Year
9/8/2022,Satisfied,Didn’t realize you had to put the $5 book in after the READ code was applied,Bonus Points/Rewards/Promos
9/8/2022,Satisfied,When I tried to delete the third book down it deleted the first book,Website Performance/Navigation
9/8/2022,Satisfied,why do we pay tax online but not directly to the school?,Account Balance/Payment
9/8/2022,Very Satisfied,Very convenient to order my daughters books through the site. It also ensures she is able to receive a copy of the books she has her heart set on this year!,Thanks/Praise
9/8/2022,Very Satisfied,Very user friendly set up and i love that you can just put the codes in and dont have to try to find the numbers or books yourself.,Thanks/Praise
9/8/2022,Neutral, The selection of books was not that great today. My son preferred books from amazon.,Products Offered/Availability
9/8/2022,Neutral,We had a hard time updating my childs teacher for the year but were able to figure it out.,Connecting Teacher/Class Code
9/8/2022,Neutral,Site flyers slow to load,Website Performance/Navigation
9/8/2022,Very Satisfied,Thank you for the great program to get books in the hands of my students.,Thanks/Praise
9/8/2022,Very Satisfied,"I have been ordering from Scholastic for many years now. Last year, the shipping delays were frustrating and made parents hesitant to place future orders.  I look forward to reasonable shipping times and ordering great books this year!",Hopeful Shipping Improves this Year
9/8/2022,Very Satisfied,Great site!!,Thanks/Praise
9/8/2022,Neutral,"I wish I could have search results sorted into ""all"" instead of pages and pages I have to keep clicking next on. An endless scroll would be nice (the kind that refreshes and pops up more results until you get to the bottom of all of them). I love the search filters that let me choose a price range.",Website Filter/Search Options
9/8/2022,Neutral,"I have been ordering from scholastic for the last 2 years. I always get confused by the many ""ways"" you can order. Book Club? As a Parent? For the school? I love Scholastic, please don't get me wrong, but I wish the site were a little more user friendly.","Unfamiliar with Different Sites (BC, SSO, TSO etc)"
9/8/2022,Satisfied,It is harder to order for my own child when I also have a teacher account.,"Unfamiliar with Different Sites (BC, SSO, TSO etc)"
9/8/2022,Very Disappointed,"I was going to place an online order with my phone because I was traveling, but it never showed me how to ""pick a pack""",Website Performance/Navigation
9/8/2022,Very Disappointed,it never showed me  my $10 to spend right now.  What's going on with that?,Bonus Points/Rewards/Promos
9/8/2022,Very Satisfied,I have used Scholastic as a teacher and a parent. I love the selection and good prices.,Thanks/Praise
9/8/2022,Neutral,"While trying to look up the second book I was taken back to the first book I looked for and it was added a second time to my account.  I was unable to find the book I was looking for, only placed a small order through the website.  I will place the full order through the order form.",Products Offered/Availability
9/8/2022,Very Satisfied,"First year joining Scholastic book club and off to a great start, user friendly and affordable book deals.",Thanks/Praise
9/8/2022,Very Satisfied,I love  Scholastic Book Clubs!,Thanks/Praise
9/8/2022,Very Satisfied,When a parent orders online I get an email to go in and approve the purchase. Should I not do that until my due date so that my order is as big as it can be? It seems doing it as they come in separates out the order and makes my total less.,Account Balance/Payment
9/8/2022,Satisfied,I had to reset my password and login in a few times. I wished there was an option once you reset your password to login directly rather than having to log in again. And the drop-down menu was difficult to click as it disappeared once I tried to mouse over any item in the list.,Website Performance/Navigation
9/8/2022,Satisfied,"I also wasn't sure if I was shopping for my child's class or not. I'm still not entirely sure when my purchase applies towards the teacher. (Do I have to go through the Book Club or can I just go through the regular shop?) With a bit more looking, I think I'll figure it out but it was a bit confusing at first glance!","Unfamiliar with Different Sites (BC, SSO, TSO etc)"
9/8/2022,Satisfied,I did find the reading level filters unfamiliar as they seemed more for teachers than parents.,Website Filter/Search Options
9/8/2022,Very Satisfied,I love Scholastic Books,Thanks/Praise
9/8/2022,Satisfied,i like it,Thanks/Praise
9/8/2022,Very Satisfied,I loved using a promo code and getting  a free book!,Thanks/Praise
9/8/2022,Satisfied,"Lost out on points from previous teacher.  She is gone so we lost her points, bummer.",Bonus Points/Rewards/Promos
9/8/2022,Neutral,"I made a mistake last time I ordered and I hope I only ordered 1 book each instead of 1,000.",All Other
9/8/2022,Very Satisfied,Added to my order but not submitting it until Friday.,Intend to Order in Future
9/8/2022,Neutral,"give  to add to cart w hover, and only add to list or ""more like this""",Website Performance/Navigation
9/8/2022,Satisfied,I am just not quite sure how to order via the teacher portal.,"Unfamiliar with Different Sites (BC, SSO, TSO etc)"
9/8/2022,Satisfied,"I love ordering from your website, but it can be difficult to navigate between the Parent, Teacher, Kid sites. In my opinion it could be more streamlined.","Unfamiliar with Different Sites (BC, SSO, TSO etc)"
9/8/2022,Satisfied,"I do not understand why you have to clean out the classroom wishlist??? Unless the book was acquired,  a person would still want it on their wishlist.   I also do not understand WHY you would clear out the class recommendations because those would not change unless the teacher changed grades. It is beyond frustrating that I  have to redo those list every year! It is at a point that I do not even like using those list! PLEASE FIX THIS!!!!",Website Performance/Navigation
9/8/2022,Neutral,I wish you could send stickers with the Class Codes on them... like in the past.,All Other
9/8/2022,Very Satisfied,Live Chat very helpful and effective/effiicient,Thanks/Praise
9/8/2022,Very Satisfied,Very easy to use for a new teacher.  I've always loved scholastic!,Thanks/Praise
9/8/2022,Disappointed,Really sad that I will not be using scholastic again this year due to the $25 minimum free shipping charge. Teachers should not have to pay because not all parents are able to purchase books. We should not have to pay out of pocket or deny students that actually want to buy books because not a lot of classmates parents allow them to.,Price
9/8/2022,Satisfied,I'm not a big fan of having that pop up every time I add something to the cart.  Yikes.  That gets frustrating fast.,Website Performance/Navigation
9/8/2022,Very Satisfied,I found exactly what my daughter wanted and some more books we may get in the future! I was never able to afford books at the book fair and I want my daughter to have a great experience! Thanks!,Thanks/Praise
9/8/2022,Very Satisfied,I my order qualified for a free book. Awesome,Thanks/Praise
