WeekOf,OverallRating,Comments,FeedbackCategory
9/1/2022,Very Satisfied,Only Difficult part was browsing for my free book with code READS.  I had to know what book I was looking for and not seeing the covers made it hard for my child to help me.,Bonus Points/Rewards/Promos
9/1/2022,Very Satisfied,Very easy to navigate site,Thanks/Praise
9/1/2022,Satisfied,Mobile had a hard time picking free book when checking out seems like it’s a tech issue,Website Mobile Compatibility
9/1/2022,Disappointed,it wouldn't let me see the books,Website Performance/Navigation
9/1/2022,Very Satisfied,Who should pay the shipping when students don't place enough orders to qualify for free shipping?,Price
9/1/2022,Very Satisfied,very easy site to manipulate,Thanks/Praise
9/1/2022,Satisfied,I would like adult opinions also to order!,Products Offered/Availability
9/1/2022,Very Satisfied,Very easy to facilitate. Easy to look up products as well.,Thanks/Praise
9/1/2022,Satisfied,This questionnaire popped up before I could do anything on the site so I can’t really give feedback.,Interrupted by Survey Pop-up
9/1/2022,Satisfied,"The whole charging tax makes me not even want to purchase any books from Scholastic.  We (teachers) buy books for our kids, libraries, and to give away...seems like the little guy gets dinged again...  I absolutely love the free books.  I am able to offer books to  kids that don't ever get to order books a book to read.  I typically by all my kids a book at Christmas.  That's the only time I can afford to do this!  Free books help out throughout the year.  Thanks!",Price
9/1/2022,Satisfied,It'd be nice to be able to search by price range. Otherwise LOVE the site and books!,Website Filter/Search Options
9/1/2022,Neutral,"Now, as an adult, all grown up, Mama of FOUR, I STILL enjoy purchasing books from the Scholastic Book Club!!! Forever will I remain excited to get books from teachers through this specific book club. Please know that this company was AWESOME when I was just a little girl (1990's) and in 2022 you guys continue to be AWESOME!!!",Thanks/Praise
9/1/2022,Very Satisfied,The site is not user friendly on your cell phone there is lots of lag time and jumpy. Logged in on desktop and much better,Website Mobile Compatibility
9/1/2022,Neutral,"Why did I get an email from scholastic with code ABC123 for up to 30% off, but I couldn’t use it on this order?",Bonus Points/Rewards/Promos
9/1/2022,Disappointed,Stop pushing LGBTQ+ books to kids.,Products Offered/Availability
9/1/2022,Very Satisfied,"I love the titles, but the books fall apart so easily.",All Other
9/1/2022,Satisfied,"Our school, Maranatha Christian Academy used to be in two buildings,  15000 W. 63rd St., Shawnee, KS  66216 AND 6826 Lackman Road, Shawnee, KS  66217.  We have now moved into a new building for grades K-12 at 7055 Silverheel Street, Shawnee, KS  66226.",All Other
9/1/2022,Satisfied,Easy registration process,Thanks/Praise
9/1/2022,Very Satisfied,This was great! I found the books easily and correctly. Was able to complete my order in just a few minutes.,Thanks/Praise
9/1/2022,Neutral,"Just wanted to search titles and it brought me to making a profiile for my child. I exited, signed in and restarted. None of the books my teachers requested were available",Website Filter/Search Options
9/1/2022,Neutral,I received an email yesterday for my child's birthday that said Wishes was a book of the week for $1. I was excited so hopped on over to the website and found it was $9...pretty disappointed.,Price
9/1/2022,Disappointed,Hi! It would be nice to have cool titles like the pigeon or the good egg and the rest of them available in spanish. My kids are bilingual but they start reading in spanish. They love those books and are available in amazon but not here.  Thank you!,Products Offered/Availability
9/1/2022,Neutral,"I was supposed to get the fly guy book for free with the READS code, but I was charged $4 for this book.",Bonus Points/Rewards/Promos
9/1/2022,Disappointed,"When viewing a flyer, i pinch to zoom in works ok.... But when i try to zoom back outthe stupid page either reloads or kicks me back to the 'choose a flyer by grade' page!! After multiple attempts i give up",Website Performance/Navigation
9/1/2022,Very Satisfied,Always very happy and satisified with the books and the help I receive when I need it.,Thanks/Praise
9/1/2022,Neutral,Still looking for where to request flyers to be sent to me.,Kits
9/1/2022,Neutral,Finding the place to update teachers class code was a bit harder than it could have been,Connecting Teacher/Class Code
9/1/2022,Satisfied,I haven't received any flyers since moving to my new school. Would love to receive paper flyers again .,Kits
9/1/2022,Very Satisfied,I never received any catalogs like I normally do so I came in the site to request them.,Kits
9/1/2022,Very Satisfied,Very easy to order with codes from flyer,Thanks/Praise
9/1/2022,Very Satisfied,Finding how to connect the teacher once the teacher/school changed.,Connecting Teacher/Class Code
9/1/2022,Neutral,add apple pay,Account Balance/Payment
9/1/2022,Very Satisfied,Good experience,Thanks/Praise
9/1/2022,Very Satisfied,WONDERFUL SELECTIONS.,Thanks/Praise
9/1/2022,Neutral,I found it hard as the teacher to order my free items as I was trying to finish up the on-line order. I love the great deals on good books available in your orders. I am discouraged that 2 of the books I ordered have a different reading level on the back of them than what the book order form showed. I am also discouraged that most of the books in the 2nd grade order form were level K-Q. At the beginning of the year many students are around level H-J.,Bonus Points/Rewards/Promos
9/1/2022,Satisfied,"I'm looking forward to using scholastic again.  Last year, I stopped after it was taking so long to receive the books.  It looks like it will be better this year!",Hopeful Shipping Improves this Year
9/1/2022,Satisfied,Viewing the online flyers was not easy to manipulate.  I had difficulty looking at the flyers and going from page to page.,Website Performance/Navigation
9/1/2022,Satisfied,"As a teacher, I had trouble linking to my account.  When I clicked the link on the email you sent with a student's order, it took me to an empty cart.  After three tries, I finally just logged in without the link, reset my account, and I was finally able to reach my current order.  I had to waste about 10 minutes with this process.",Connecting Teacher/Class Code
9/1/2022,Very Disappointed,It won’t take my payment. It says declined when I have the funds.,Account Balance/Payment
9/1/2022,Very Satisfied,I love Scholastic Book Clubs. It makes getting good books in my student's hands so easy and affordable! I understand there was major shipping delay during COVID but I assume and hope it's much faster now!,Hopeful Shipping Improves this Year
9/1/2022,Neutral,"Drives me crazy when I cannot purchase an individual book, it only comes in a pack. My daughter had already read the first book and only wanted the sequel.",Products Offered/Availability
9/1/2022,Satisfied,Asked me to do the survey before I was able to do anything else,Interrupted by Survey Pop-up
9/1/2022,Satisfied,Mobile version is a little wonky but I was able to do what I need- is there an app?,Website Mobile Compatibility
9/1/2022,Very Satisfied,"I was first at the Scholastic site and was very confused, as I tried to enter an item # and it wasn’t accepted for search. It wasn’t until I googled Scholastic book order that I found the right site. Maybe I missed it, but it would be helpful to have a button at the top of the other site directing to the Book Club site. (Once I found it, excellent experience!)",Website Performance/Navigation
9/1/2022,Satisfied,I wasn't able to navigate to the appropriate page from the home page.,Website Performance/Navigation
9/1/2022,Satisfied,I would like to be able to purchase sequel books not in sets.,Products Offered/Availability
9/1/2022,Neutral,This site needs to be easier to navigate.  I would like to type in an item number on the first page and see the item come up.  Also classroom flyers should be listed on the first page so we can find books easier.,Website Filter/Search Options
9/1/2022,Disappointed,"Never found how to get a free book after spending $140. As a new user, it was really hard to figure out since  I am the Grandma and do all the extras for my granddaughter and am not tech savvy but want to order on line.  Took me forever to get the job done.",Bonus Points/Rewards/Promos
9/1/2022,Neutral,Very easy to navigate.  Love the put in the ITEM # feature. Easy and quick!,Thanks/Praise
9/1/2022,Neutral,My son loved the choices,Thanks/Praise
9/1/2022,Very Satisfied,Great suggestions based on grade level!  Helpful for choosing books for my child.,Thanks/Praise
9/1/2022,Disappointed,I just want to look at flyer and by books,Website Filter/Search Options
9/1/2022,Satisfied,I could not type in item number on opening page.,Website Filter/Search Options
9/1/2022,Neutral,Would like to be able to sort by grade level AND language,Website Filter/Search Options
9/1/2022,Very Satisfied,Easy signup,Thanks/Praise
9/1/2022,Very Satisfied,I haven't made out my order yet.,Interrupted by Survey Pop-up
9/1/2022,Neutral,"I could not log into my account.  When I would click log in a blank white box would pop up, but there would be no place to sign in.",Website Performance/Navigation
9/1/2022,Disappointed,Trying to find First grade appropriate books in terms of low price $1. I'm not sure that Pout Pout The Fish is a good option for my second language learners.,Price
9/1/2022,Disappointed,Changed preschool and having significant difficulty entering new one time only class activation code.  New code MJL24,Connecting Teacher/Class Code
9/1/2022,Very Satisfied,Easy peasy!  Lemon squeezy!,Thanks/Praise
9/1/2022,Neutral,"I would like to see ALL of the $5 and under books, not just a select few.",Website Filter/Search Options
9/1/2022,Very Disappointed,Link broken,Website Performance/Navigation
9/1/2022,Neutral,Why can’t you search for books across all grade levels at once,Website Filter/Search Options
9/1/2022,Neutral,I noticed that 10 for $10 is no longer available. For the past 2-3 years I would purchase monthly books for my students to help build their home libraries.,Price
9/1/2022,Very Satisfied,My first experience with Scholastic's site was fine with no issues.,Thanks/Praise
9/1/2022,Neutral,Hard to find out where to find my class,Connecting Teacher/Class Code
9/1/2022,Very Satisfied,This was the first time a parent gave a check and I was worried. You made it very simple to add the books to the order and list that I would be mailing the check in. Thank you for making the process quick and easy for teachers!,Thanks/Praise
9/1/2022,Very Satisfied,Was a breeze! Thanks 🙏🏽,Thanks/Praise
9/1/2022,Neutral,"When I got into the site, I didn't immediate see a way to browse books by category. It took me a while to figure out how to see Nonfiction books for my son's grade level, for example. I also kind of wanted recommendations -- can I see all award-winners? Classice? What does the teacher think would be great at different levels?. And when I found the ""book finder"" I was disappointed that it was mostly topical  ... it wasn't until I got to the suggested topics/books that i could pick nonfiction and grade, etc. This functioned more like a search filter -- that wasn't very complex or thorough.    I wanted to know if some of the series (Fly Guy, Bad Guys) sold the single book my kid needed and not just the packs. I saw other single books in the series, but why couldn't I order any of the series?    I also have no idea, really, what my kid's reading level is. I know it was on his last report card, but ... It'd be really cool if that was known / entered by the teacher and then I could target th",Website Filter/Search Options
9/1/2022,Satisfied,"I had great success submitting my order as a parent.  HOWEVER, I am not currently teaching in the classroom.  I tried and tried to update this, but it would not allow me to update.  I am afraid that you will start sending me mail to my daughters' school!  PLEASE don't!!",Connecting Teacher/Class Code
9/1/2022,Very Satisfied,Very easy to order the books that I wanted.,Thanks/Praise
9/1/2022,Satisfied,My internet was slow and took forever loading images.,Website Performance/Navigation
9/1/2022,Very Satisfied,Like how I could shop the flyer,Thanks/Praise
9/1/2022,Satisfied,👍👍👍🧡🧡🧡,Thanks/Praise
9/1/2022,Disappointed,Well I finally just got in and it asked if I would be willing to do a survey when I was finished.  I just got started.  Now I m stuck in this survey after it took me forever to change my password.,Interrupted by Survey Pop-up
9/1/2022,Satisfied,I Would love to see more classic stories books offered in your monthly  catalogs.  Thanks,Products Offered/Availability
9/1/2022,Satisfied,I like how easy it is to add books to the order. This is my first time using a combination order so hopefully I can report back later with any feedback.,Thanks/Praise
9/1/2022,Very Satisfied,Upon closing the order and paying for the materials I ordered I was unable to use the $10 extra with the order but I was able to use the bonus points I earned.,Bonus Points/Rewards/Promos
9/1/2022,Neutral,"It tells me I'm eligible for $10 Free in books as a teacher for my student orders, but then it shows I owe $.",Bonus Points/Rewards/Promos
9/1/2022,Satisfied,cancelling the paper mail.,Kits
9/1/2022,Disappointed,"Code ""READS"" is on flyers and advertised on site, but says expired when tried to use.",Bonus Points/Rewards/Promos
9/1/2022,Very Disappointed,I cannot create an account-it keeps saying I have created one but then doesn’t recognize my email when I try to sign in.,Website Performance/Navigation
9/1/2022,Neutral,I often have trouble selecting a due date - i often do.  It would be very nice to have a box to type the date in directly.,Website Performance/Navigation
9/1/2022,Very Satisfied,Really easy to use. Faster than filling out the book order form!,Thanks/Praise
9/1/2022,Very Satisfied,"Site was very easy to navigate, and having the flyer from school made it easy to get all of the books we wanted to get with one simple search.",Thanks/Praise
9/1/2022,Neutral,Im still looking.,All Other
9/1/2022,Neutral,I find this site difficult to use.,Website Performance/Navigation
9/1/2022,Neutral,Disappointed that I can't buy individual books (like Biscuit Finds a Teddy Bear).  I will have to buy it elsewhere.  Don't want the other books in the pack.,Products Offered/Availability
9/1/2022,Satisfied,Open up to pay with debit cards for books.,Account Balance/Payment
9/1/2022,Neutral,"The $5 free book promo is great, except only a few book qualify. With the increase in your overall prices, it would be nice that this goes up to some to at least $6 but maybe even $10.",Price
9/1/2022,Disappointed,"I use chrome and safari to get to scholastic's web site.  Sometimes it opens, usually I get a white box when I click ""sign in"" and it doesn't open.  I viewed my cart and do not see a button to click to submit the student's online orders - very frustrating!!!  It used to be easier to navigate.",Website Performance/Navigation
9/1/2022,Satisfied,Hard to navigate and see full page on phone.,Website Mobile Compatibility
9/1/2022,Neutral,We like to build a wish list when we get our classroom flyer and then decide on final purchases later.,Intend to Order in Future
9/1/2022,Very Satisfied,"Ran out of time, but will be back.",Intend to Order in Future
9/1/2022,Very Disappointed,"your flyer application is very buggy, not intuitive.  you have make an account to place an order.",Website Performance/Navigation
9/1/2022,Neutral,"I used to love Scholastic books and spent many $$$'s on your books at book fairs, on your site, and through classroom book orders.  But my youngest is now a HS senior, and I have noticed that nearly all of your books for his age level are dark and depressing, almost no light-hearted reading.  Kids are already anxious and depressed about the world as it is, and you are just adding to that. And worst yet is that you now are peddling LGBTQetc books to young kids.  So, this is good-bye from me, no more Scholastic purchases from me. And I have already been  telling my concerns about Scholastic to other parents and educators too.",Products Offered/Availability
9/1/2022,Very Satisfied,Very user friendly especially for the free book with code,Thanks/Praise
9/1/2022,Satisfied,"I thought I had bonus points/dollars in my account but I do not see any.  I tried to look at my history, but it does not show anything.  It has been a while since I used it so maybe I lost them due to inactivity or something.",Bonus Points/Rewards/Promos
9/1/2022,Neutral,Everything is pretty smooth and easy for a parent to order.,Thanks/Praise
9/1/2022,Very Satisfied,Thank you for your products.,Thanks/Praise
9/1/2022,Satisfied,"Searched for title offered but it came up no items found.  Also tried to submit a new teacher's email and got a message saying I couldn't (I'm hopeful that she has already been invited).    I'm annoyed by the term ""inflation buster"" in the teacher marketing.  These were not specific to inflation, but similar to the back to school offers I have seen for the past 25 years.",Website Filter/Search Options
9/1/2022,Very Satisfied,"Purchased something from the bonus catalog .  Got an email asking me to review, but I have not received anything yet.  And in my orders it says that is in progress but can't not track or see the the order.",Delayed Shipping/Delivery
9/1/2022,Neutral,Site has gotten easier to navigate on mobile device. Thank you!,Thanks/Praise
9/1/2022,Neutral,Missed two sets book before.,Delayed Shipping/Delivery
9/1/2022,Disappointed,I made an order in the 2021-2022 school year I was informed the item would be delayed I used my bonus points and it still was never delivered I would like the item table and chairs or my bonus points back please!,Delayed Shipping/Delivery
9/1/2022,Neutral,"It’s ok, but was difficult to navigate on iPhone, screen moves around too much., not right sizing. Don’t really use actual computer much. Do most stuff through phone.",Website Mobile Compatibility
9/1/2022,Very Satisfied,My school has not received any catalogs. I want to receive them monthly.,Kits
9/1/2022,Neutral,"hard to find this website with web search, got to general scholastic website, but to find this was a challenge",Website Performance/Navigation
9/1/2022,Satisfied,This was the first time I am putting in an order.  To be able to use the reward points to get free books for my classroom was very confusing.  I thought I was able to order the dollar books and use my $10 rewards but it did not work.,Bonus Points/Rewards/Promos
9/1/2022,Satisfied,Trying to update my child's teacher code for this school year's orders.,Connecting Teacher/Class Code
9/1/2022,Satisfied,"I've ordered for years but I never remember to mention this.  I wish the search engine worked better.  Sometimes I""m looking for books about a specific topic but the search engine is not capable of doing that.  That is so frustrating.  For instance, today I was looking for books the hospital staff could read when they come to visit the school.  I couldn't find any so I ended up ordering on Amazon.",Website Filter/Search Options
9/1/2022,Satisfied,"I was looking for my bonus points for referring a teacher, I haven't seen anything added this week.",Bonus Points/Rewards/Promos
9/1/2022,Neutral,"I do not know what the Scholastic Book Clubs is, but I assume this is what it is.    This website could cross-sell more effectively because I am buying off of a piece of paper but you could logically connect related items.",Website Performance/Navigation
9/1/2022,Satisfied,"Maneuvering between the educators site, the parents site the kids site and the books club site was confusing.",Website Performance/Navigation
9/1/2022,Very Satisfied,Very pleased with the process of purchasing and the quality of my purchases.,Thanks/Praise
9/1/2022,Satisfied,"I was excited to receive the offers because of my large class order but I was confused about how to redeem them. A disclaimer about using the offers on the checkout page would have been helpful. I kept going back to the shopping page to try to redeem them and was unable to so I gave up. Then when I went to checkout, I saw where the offers were listed.",Bonus Points/Rewards/Promos
9/1/2022,Neutral,"Great site, user friendly. I use it often and have for a number of years.",Thanks/Praise
9/1/2022,Satisfied,"It was fine.  Lots of places to go though.  Had to get a recommendation from my Daughter-in-law,   it would have been nice to know if someone else had already ordered so I didn't order the same thing as someone else.",All Other
9/1/2022,Satisfied,"Would have liked to find all books for a grade level in one spot, not separate by magazine.",Website Filter/Search Options
9/1/2022,Satisfied,"After clicking on a book to get more info., when click X it does not take me back to the screen/flyer I was on. It goes back a few screens.",Website Performance/Navigation
9/1/2022,Disappointed,It’s a pretty slow site and finding the place to enter the teacher code is not user friendly,Connecting Teacher/Class Code
9/1/2022,Satisfied,I can't figure out what my code is to share with parents.,Connecting Teacher/Class Code
9/1/2022,Disappointed,Difficult to navigate on mobile tablet/ touchscreen. Seems like a grave oversight considering how many schools are one-to-one ipad.,Website Mobile Compatibility
9/1/2022,Satisfied,Promo code READS did not stay in my cart but I sent you an email asking for help,Bonus Points/Rewards/Promos
9/1/2022,Neutral,"I saw a book in  the Social Studies section and I clicked on it - Amelia Earhart, and it did not come up.  I even did a search and it didn't come up.",Products Offered/Availability
9/1/2022,Very Satisfied,I was directed to other sites within Scholastic which has never happened before.,Website Performance/Navigation
9/1/2022,Satisfied,I'd like to know if your issues have been fixed? Orders from last year took so long that my students/families quit ordering almost completely.,Hopeful Shipping Improves this Year
9/1/2022,Satisfied,"Every spring and/or summer I receive coupon codes to use for the fall book order, and every year they do not work when I place the order.  Last year, I called in and the operator had not hear of the coupons and could not find them in her system. This year I had the same issue, but I was unable to call anyone due to the offices being closed on Saturday.  I will try again to call next week.  This year I kept the emails and information about what the coupons were for and the amount of bonus points, not just the coupon codes.",Bonus Points/Rewards/Promos
9/1/2022,Satisfied,Last year it took months for orders to be filled. I thought I'd give Scholastic another chance. I hope you have the staff and your paperwork figured out this year!,Hopeful Shipping Improves this Year
9/1/2022,Very Satisfied,Easy way to order books,Thanks/Praise
9/1/2022,Satisfied,"It is my first time.  I’m getting familiar with it.  My son loves books, and we encourage him.",Thanks/Praise
9/1/2022,Very Satisfied,will be getting books after we decide which ones.,Intend to Order in Future
9/1/2022,Neutral,I havent gotten to really look without being prompted to take this survey first.,Interrupted by Survey Pop-up
9/1/2022,Neutral,I just created my first class account after 20 years and found the site very user friendly!!  Thank you!!,Thanks/Praise
9/1/2022,Neutral,Options are not many and it is hard to navigate.,Website Performance/Navigation
9/1/2022,Neutral,difficult to find the 6books section???,Website Performance/Navigation
9/1/2022,Satisfied,"Navigation is not easy.      After a while, I was able to figure it out because it is Saturday evening and I have time.  However, I am unsure if I can frequent this site while at school, as it will take to much of my time.",Website Performance/Navigation
9/1/2022,Very Satisfied,I left one student order at school.  I will have to finish when I get back to school.,Intend to Order in Future
9/1/2022,Very Satisfied,It’s wasy,Thanks/Praise
9/1/2022,Neutral,More girl books for empowering,Products Offered/Availability
9/1/2022,Very Satisfied,Better and easier to use...,Thanks/Praise
9/1/2022,Very Satisfied,Great organization and did not error code when I used my bonus point codes!,Thanks/Praise
9/1/2022,Very Satisfied,Great affordable books. I love that there is often a deal for a free book!,Thanks/Praise
9/1/2022,Neutral,when having two kids it takes bit to figure it out.      Id like to be able to search according to interest or reading level.  I tried but could not accomplish it as well as I thought,Website Filter/Search Options
9/1/2022,Very Satisfied,I’m excited Scholastic is still doing things with classrooms. I remember how exciting Scholastic Book Fairs were.,Thanks/Praise
9/1/2022,Neutral,For a first time user it was hard to figure out if was supposed to creat an account after typing in the classroom code.  There isn't a button below the classroom code location to click. You have to exit from that screen which then links you to the correct page.  Now I have a teacher account set up and I'm not a teacher.,Connecting Teacher/Class Code
9/1/2022,Satisfied,Wondering why I would see a lot more books when we. We’re in public schools vs how few profiled  books are  viewable as a parent at a private school.,All Other
9/1/2022,Neutral,Website design is lacking in maneuverability and layout seems cluttered,Website Performance/Navigation
