WeekOf,OverallRating,Comments,FeedbackCategory
7/14/2022,Very Satisfied,Scolastic is Excellent in EVERY WAY.,Thanks/Praise
7/14/2022,Very Satisfied,It was the easiest time I have ever had using the book club site.  Thank you for making it easy for me to find info and place my order using bonus points.,Thanks/Praise
7/14/2022,Neutral,Prices went up.,Price
7/14/2022,Very Satisfied,Wish I could buy points to buy more teacher items. Also need better customer service on how to make sure my orders come to my school on time. Last year it took three months to get my order.,Hopeful Shipping Improves this Year
7/14/2022,Very Disappointed,I tried to send a referral link to my daughter's work email. She has her own classroom this next school year. It kept saying that it couldn't be sent. Her email address is roberta.murph@risd.org.  Maybe you could help. She could really use it.,Website Performance/Navigation
7/14/2022,Satisfied,"I was disappointed that I placed an order over $120, but I was unable to use the Dollar Store. I could have waited until August 1st, but I was afraid I would lose the deals I had found during my visit.  Also, my free books plus money to spend appeared and then disappeared. I am not sure why.",Bonus Points/Rewards/Promos
7/14/2022,Satisfied,"I am disappointed that your selections online had no results for searches like ""Christian"" (other than an author), ""Jesus"" or ""prayer"". You used to have a t least a small selection of ""religious"" books online.",Products Offered/Availability
7/14/2022,Satisfied,"Once I entered my order it prompted me and said I had 2 rewards. One free 5 pack of books and $10 to spend right now.  However, when I clicked both links to choose my selections it only brought me to blank pages so I never go to select my rewards.",Bonus Points/Rewards/Promos
7/14/2022,Very Disappointed,Problems ordering books with code,Bonus Points/Rewards/Promos
7/14/2022,Neutral,I am an international user. The Book Club seems to be available only for US residents.,All Other
7/14/2022,Very Satisfied,I had a great experience here today. Last school year I stopped with Scholastic orders because there were so many shipping issues and delays. I am excited to try again this school year. I understand that because of COVID it has been hard for many companies to get started at their previous work load so hopefully now all the kinks are worked out.,Hopeful Shipping Improves this Year
7/14/2022,Satisfied,As a teacher I really miss the $1 books on the fliers!!,Price
7/14/2022,Disappointed,Teacher's name not on list. This is her first year teaching and I wanted to buy her some books for her classroom. I'm her grandmother.,Connecting Teacher/Class Code
7/14/2022,Very Satisfied,EASY time placing an order!!!!!,Thanks/Praise
7/14/2022,Satisfied,"I had to adjust using my points to complete my order. I thought I had enough to use on another book set, but I did not. Hence, once at payment, I had to go all the way back to the cart to re-adjust how I distributed the points.  I wish it would automatically apply points so I can get the best deal.",Bonus Points/Rewards/Promos
7/14/2022,Disappointed,I feel like I have two separate accounts with the same login information because I find it difficult to shop and earn points.,Bonus Points/Rewards/Promos
7/14/2022,Neutral,I don’t have a teacher code and it will not let me order books for my two boys one who is 1 turn 2soon and my 14 year old,Connecting Teacher/Class Code
7/14/2022,Satisfied,"Once you have an account everything is easy, setting up an account was difficult.",Website Performance/Navigation
7/14/2022,Neutral,"I love scholastic book club, I enjoy browsing and shopping for cute and educational book choices for my son... I can't wait to see what new books to buy and browse next.",Thanks/Praise
7/14/2022,Very Satisfied,"Finding the dollar books was easy, check out was easy, and every part of ordering was a breeze! Loved the free shipping as well!",Thanks/Praise
7/14/2022,Neutral,It is hard to find what I need and see new books.,Website Filter/Search Options
7/14/2022,Disappointed,"the selection of award winning and traditional books on this website and offered by scholastic at this time is very disappointing.  unfortunately, the woke nature of all of the material offered makes it difficult for parochial school teachers to get the materials we need and my school will not allow me to send book orders home at this time.",Products Offered/Availability
7/14/2022,Very Satisfied,"I like the variety of books, and navigating the website is pretty easy.",Thanks/Praise
7/14/2022,Very Satisfied,Love getting books from here! It would be great if we could search by type of book such as nonfiction. My students always love getting books from here!,Website Filter/Search Options
7/14/2022,Neutral,Please offer free shipping to  home.,Ship to Home
7/14/2022,Satisfied,Many of the books I wanted to order were no longer available.,Products Offered/Availability
7/14/2022,Very Satisfied,I love that we can get 10 books for $10. That's always what I get so I can give my kids a book a month.,Thanks/Praise
7/14/2022,Neutral,"I wish there was a way to view ""all picture books"" or ""all chapter books. If there is a way, I have not been able to figure it out.",Website Filter/Search Options
7/14/2022,Very Satisfied,Where is the fall/Halloween section. Nothing comes up...,Products Offered/Availability
7/14/2022,Neutral,I'm hoping that since all the craziness of last year everything is back to normal and I will start getting my stuff in a timely manner again.   I love having the points to put towards free books for my classroom.,Hopeful Shipping Improves this Year
7/14/2022,Satisfied,Last year I did not continue to share order forms with my families due to shipping wait time.,Hopeful Shipping Improves this Year
7/14/2022,Very Satisfied,I did not intend to sign up for paper flyers.,Kits
7/14/2022,Neutral,"I haven't been on the site in a long time and I was very disappointed with the selection for bonus points items. I had saved up my points in order to get practical items for the classroom such as a new electric pencil sharpener, or music player.  In the past your site offered these kind of larger items that teachers often need and pay for with their personal funds.  These kind of items should always be offered in my opinion, I had 6,151 points to spend and walked away with junk.",Bonus Points/Rewards/Promos
7/14/2022,Very Satisfied,I just had to update  my credit card information with a new expiration date.,Account Balance/Payment
7/14/2022,Very Satisfied,"It is frustrating that is still charges tax for a public school. We are tax exempt. I have an outstanding balance because on a previous order where the taxes were not removed. Other than the tax issue, scholastic is one of my favorites. The site is easy to navigate, always has a great selection at fair prices.",Account Balance/Payment
7/14/2022,Satisfied,"I placed an order over $25 and was still unable to get the promo code 'reads' to work, despite the fact that a promo kept popping up with that code. I was unable to get the free book and just place the order without. Is the code not working?",Bonus Points/Rewards/Promos
7/14/2022,Satisfied,I tried to apply the code for the free book multiple times with different books that totaled above $25 and was unable to apply the code.,Bonus Points/Rewards/Promos
7/14/2022,Satisfied,Thanks you for lowering free shipping total to $25 again.,Thanks/Praise
7/14/2022,Very Satisfied,some items not available - where's the tech??,Products Offered/Availability
7/14/2022,Satisfied,"the coupon code ""Reads"" did not work",Bonus Points/Rewards/Promos
7/14/2022,Very Satisfied,"I was not able to use the coupon code for the free book, READS.",Bonus Points/Rewards/Promos
7/14/2022,Very Satisfied,"I love that I am able to order books for my classroom at a decent price, & my students families can also do that same.",Thanks/Praise
7/14/2022,Neutral,Please have more Spanish books! I would like to see a wider selection of Spanish books (fiction/nonfiction).,Products Offered/Availability
7/14/2022,Neutral,It was painfully slow to load the pages.  Remember the days of dial-up internet?  It was that bad all day.  (I tried more than once.).  It's just your website that's slow.  Other sites are fine and fast.,Website Performance/Navigation
7/14/2022,Very Satisfied,"Affordable books, easy to use website.  I should receive some bonus points for completing  the survey.",Bonus Points/Rewards/Promos
7/14/2022,Disappointed,I have a credit on a gift card and it did not  appear.,Account Balance/Payment
7/14/2022,Very Disappointed,"I have never had so many problems as I have had this past school year. I did a classroom campaign to raise money for books for my students. When I go back and look at every order I placed, it says the total was one thing, but I ended up paying a few dollars over that. I would never do that unless the original total had told me that's what it was. I received a handful of emails throughout the school year telling me I owed money for orders, when I paid straight away with the money in my classroom funds. This is ridiculous. I hate that I don't even want to use this website anymore because the kids love when they get free books from me. I have done this the last four years. But, the hassle everything has been this year is not worth it.",Account Balance/Payment
7/14/2022,Very Satisfied,"I just want you to know how much we appreciate your site.  Buying books for a classroom library can be expensive and daunting.  You've made the process so easy!  Also... Thank you, Joy, for helping me get my account straightened out.  I truly appreciate you.",Thanks/Praise
7/14/2022,Very Satisfied,I love the book packs that allow me to save money in order to get books in all of my student's hands.,Thanks/Praise
8/4/2022,Very Satisfied,I couldn't find Target gift cards in the bonus items.  A chat representative directed  me as to how to order them.  Thanks Yvonne.,Thanks/Praise
8/4/2022,Very Disappointed,"I can't check out without information about my child's teacher, which I will not have until school starts.",Website Performance/Navigation
8/4/2022,Very Satisfied,Easy to navigate,Thanks/Praise
8/4/2022,Very Satisfied,"I truly appreciated you making book packs for $7 affordable for teachers! I am purchasing books each month, 1 for each student and this makes it so wonderful!   Thank you!!!!",Thanks/Praise
8/4/2022,Neutral,"I wish the books were sent directly home, it takes too long to get to the school.",Ship to Home
8/4/2022,Satisfied,No longer states if a book is paperback or hardcover. Ordered a Piggy and Elephant and have no idea if it's paper or hard.,Products Offered/Availability
8/4/2022,Very Satisfied,When I was in school I loved this in school I wanted to have it for my 5 year old at home but it's for teachers,Products Offered/Availability
8/4/2022,Very Disappointed,I don't like that my other books were taken out of my cart. I had books in my cart from 2 weeks ago and they have disappeared. That never happened before. It is upsetting when you think you are coming to check out and your books are gone. ,Website Performance/Navigation
8/4/2022,Neutral,"I also don't like that there is almost no way to get $1 books! I got them today because I bought birthday coupons, but normally, I would not spend that much and I would not be able to get the books at this price. Please bring back the 10 for $10 or something that is affordable for teachers trying to purchase class sets of books.",Price
8/4/2022,Very Satisfied,"I would like to see Eric Carle picture books, particularly Very Hungry Caterpillar and Brown Bear, Brown Bear.  Thank you",Products Offered/Availability
8/4/2022,Neutral,The flexible seating option I wanted was out of stock.,Products Offered/Availability
8/4/2022,Disappointed,Can no longer find books listed by a/r level. There are never enough K-1 a/r books.,Products Offered/Availability
8/4/2022,Very Satisfied,Do not yet have teacher assignment,Website Performance/Navigation
8/4/2022,Very Disappointed,I have been having trouble logging into my account. It takes too long to call someone to fix my issues.,Website Performance/Navigation
8/4/2022,Very Satisfied,Love Scholastic Books,Thanks/Praise
8/4/2022,Neutral,BRING BACK THE BONUS POINT MACBOOK!  I've saved up bonus points for years to get a MacBook and NOW you take them off your Bonus Points rewards. Really frustrating. I won't spend another dollar with Scholastic until they are back.,Bonus Points/Rewards/Promos
8/4/2022,Satisfied,"Hard to find the offers only available to teachers. I saw it once and looked at it, and then couldn't find my way back.",Website Performance/Navigation
8/4/2022,Very Satisfied,love Scholastic,Thanks/Praise
8/4/2022,Very Satisfied,"I'm hoping that the orders will be processed and shipped quicker this year. For over 30 years my class has always loved book orders, and last year everyone was disappointed.",Hopeful Shipping Improves this Year
8/4/2022,Very Satisfied,Thank you for having a wonderful book at a price I could afford for my class!,Thanks/Praise
8/4/2022,Very Satisfied,Still looking for CD Book sets,Products Offered/Availability
8/4/2022,Satisfied,The log in was freezing up before I could put in my password.,Website Performance/Navigation
8/4/2022,Neutral,How do I change the teachers name associated with this class?,Website Performance/Navigation
8/4/2022,Very Satisfied,"I really. really  like the improved site .  You can save your order and come back to it later  and it is still there.! You can actually  select the pack of free books that you want, and when done ordering  everything is displayed at the end, including a listing of the free stuff as well as what was obtained by using book certificates. Thank you for those improvements. The improved site makes ordering so much easier, faster. and more productive.",Thanks/Praise
8/4/2022,Very Satisfied,I love ordering books for my classroom and for my son as well on this website!,Thanks/Praise
8/4/2022,Very Satisfied,Wished there would have been some 25 for $25 sets or something similar.,Price
8/4/2022,Satisfied,Couldn't find the 25 books for $25 when I was looking today for library building sets. Are they no longer available or was is just my inability to find them? Hopefully it was just me.,Price
8/4/2022,Very Satisfied,The site is super easy to use and I love that I can browse the digital flyers and order straight from them.,Thanks/Praise
8/4/2022,Satisfied,"Sometimes it is just hard to navigate. For example, one of my colleagues had to point out the teacher exclusive tab to me.",Website Performance/Navigation
8/4/2022,Satisfied,"My only concern is how long it will take for the books to be delivered!  Last year when I ordered books the first week of Nov., they arrived the day before Christmas vacation.    I love Scholastic Book Clubs.  I've been with you nearly 30 years.  Wait.  How is that possible????    :)",Hopeful Shipping Improves this Year
8/4/2022,Satisfied,"When trying to view all of the options in the Bonus Catalog, it did not allow me to do that.",Website Performance/Navigation
8/4/2022,Satisfied,Please expand the dollar book club selection and make it always available again!  We teachers are killing ourselves trying to keep books in our students hand often out of our OWN POCKETS!,Price
8/4/2022,Very Satisfied,I wish I could select the reading level for the free books. I am a reading specialist and I teach all grade levels.  I wish I could pick the book pack that best fits the needs of my students (and library).  I have plenty of k-1 books . it is the higher level books that I am short on.    When did taxes start? How does that work.  does the teacher get stuck paying the taxes?,Account Balance/Payment
8/4/2022,Satisfied,I am not thrilled that the 10 for $10 books are no longer available.  Hopefully they will come back soon!,Price
8/4/2022,Satisfied,"I was looking for some items I purchased with bonus points awhile back, it does not seem like you carry them anymore.",Bonus Points/Rewards/Promos
8/4/2022,Very Satisfied,It helps that I can have it delivered to my house while the school isn't open yet and hopefully I will get it on time! :),Thanks/Praise
8/4/2022,Very Satisfied,Looking for a Jon Klassen value pack,Products Offered/Availability
8/4/2022,Satisfied,The website is  organized great!  I love that my students can order from any of the catalogs.,Thanks/Praise
8/4/2022,Disappointed,"I had some coupon to be used ~ and I couldn't find it.....perhaps it was at school.  It would be very helpful to have the coupons added to one's account ~ otherwise, I imagine a lot of coupons go unused.   ",Bonus Points/Rewards/Promos
8/4/2022,Disappointed,"After the experience last year with books being sent to UPS store, a child's house that didn't order MY books ~ I was very hesitant to even order this year.",Hopeful Shipping Improves this Year
8/4/2022,Satisfied,"I wish you'd bring back more classics, like fairy tales.  TV show and movie based books are always such garbage.",Products Offered/Availability
8/4/2022,Very Satisfied,Love the getting new books for classroom library,Thanks/Praise
8/4/2022,Neutral,I did not find Un beso en mi mano or any of Froggy collections in Spansih,Products Offered/Availability
8/4/2022,Very Satisfied,I love Scholastic!!!,Thanks/Praise
8/4/2022,Satisfied,I couldn't figure out how to submit a parent order... didn't see it until I switched out of parent mode. Confusing!,Website Performance/Navigation
8/4/2022,Neutral,"I wish there were thumbnails or visuals of the books that I can select as our ""free book"".  Instead, it just gave us a list.",Website Performance/Navigation
8/4/2022,Satisfied,I had to refresh the screen a few times when I would click the arrow to proceed to the next page of results and the site wouldn't respond. It is possible that the issue is my internet as I am out of town.,Website Performance/Navigation
8/4/2022,Very Satisfied,Don’t understand why the books can not be sent directly to me.  That they go to the teacher who distributes them.   If the order is over a certain amount it should go directly to the parents home.,Ship to Home
8/4/2022,Disappointed,"I've always loved using Scholastic as a book resource for my classroom. However, last school year, I received my order months late. As a result, I was forced to notify all of my parents as to why their children's books were so late and I was forced to find books for my classroom elsewhere. This was definitely an inconvenience to me and upsetting to both my students and their parents. I'm hoping this year will be different.",Hopeful Shipping Improves this Year
8/4/2022,Satisfied,Trying to find my way around.,Website Performance/Navigation
8/4/2022,Very Satisfied,Appreciate you lowering the amount to 75$ for opening the dollar section.,Price
8/4/2022,Neutral,great selection of books,Thanks/Praise
8/4/2022,Satisfied,I found great books! I would like some book recommendations on what children are enjoying to read in the 3rd and 4th grade.,Thanks/Praise
8/4/2022,Neutral,I would like to add prepayment onto my account. I cannot figure out how to do this.,Account Balance/Payment
8/4/2022,Neutral,"I love scholastic, only it's expensive to ship to Hawaii (hence the 7 out of 10), otherwise it would be 10 out of 10.",Price
8/4/2022,Neutral,will not let me redeem READS coupon for free book when my total is $27,Website Performance/Navigation
8/4/2022,Very Satisfied,Love the Class Campgain!! Thank you!,Thanks/Praise
8/4/2022,Very Satisfied,I was disappointed that several book titles that were in the scholastic teacher store that I was interested in were not available on the book club site.,Products Offered/Availability
8/4/2022,Satisfied,I couldn't navigate easily from a flyer to the main site to search by grade level.,Website Performance/Navigation
8/4/2022,Neutral,Children's wishlist should be universal for families and friends to see,Website Performance/Navigation
8/4/2022,Neutral,I wish there were more choices for upper elementary readers. I already have purchased many of the books offered online.,Products Offered/Availability
8/4/2022,Very Satisfied,I wish that the 10 book value pack was still available!,Price
8/4/2022,Very Satisfied,I am actually neither a parent or teacher. I bought some books for a friend's classroom.,Thanks/Praise
8/4/2022,Satisfied,Figuring out how to get the GRL level I wanted. Finding the value books.,Website Performance/Navigation
8/4/2022,Very Satisfied,I would love some more options in the teacher bonus catalog. School supplies that teachers often spend our own money on would be ideal!,Bonus Points/Rewards/Promos
8/4/2022,Very Satisfied,I love the teacher dollar store and would love to see more dollar books.  Each year I get sponsors to donate to purchase books for my class and asking for more money for $2 books isn’t ideal.,Price
8/4/2022,Satisfied,"I couldn't find the $5 shop, but I finally typed in the code and it brought up a whole list, so that was nice once I figured it out",Website Performance/Navigation
8/4/2022,Satisfied,Adding bonus points to order is confusing.,Website Performance/Navigation
8/4/2022,Satisfied,"Bring back the $1 books for everyone regardless of the amount purchased. Not only does this limit the books teachers can afford to buy for their students, it also makes it harder for parents to purchase books they can afford. As a former title 1 teacher this makes a difference.",Price
8/4/2022,Satisfied,It seems as if the teacher catalog has fewer items that in the past.  Several items that I thought were available and wanted to  get with bonus points are not listed.,Bonus Points/Rewards/Promos
8/4/2022,Very Disappointed,"I have changed my email address 3 times. Each time I log out and log back in, it is back to my old email address. I also paid the balance on my account. After logging back in, the balance is back there again. I hope I do not regret using Scholastic Book Clubs again. Last year was a terrible experience and it's beginning to look that way again.",Website Performance/Navigation
8/4/2022,Disappointed,I want to find a book and not do all this administration stuff,Website Performance/Navigation
8/4/2022,Very Satisfied,There are too many places to look on this site.  I always have difficulty finding the value books.,Website Performance/Navigation
8/4/2022,Very Satisfied,I have ordered from Scholastic in the past and have always been pleased.  I do recall not utilizing Scholastic as much this past school year because of the long delay in receiving orders.,Hopeful Shipping Improves this Year
8/4/2022,Neutral,The price of your books has increased significantly.  Many families will not be able to buy books.,Price
8/4/2022,Neutral,Will there be 10 books of the same title for $10?,Price
8/4/2022,Very Disappointed,I can't find my child's teacher,Website Performance/Navigation
8/4/2022,Satisfied,I was hoping to find books for $1 to purchase for my students and did not find any .,Price
8/4/2022,Neutral,I had trouble finding where to enter my daughters teacher code but I searched the help tab and quickly found an accurate resolution.,Website Performance/Navigation
8/4/2022,Very Satisfied,great and easy to follow,Thanks/Praise
8/4/2022,Very Satisfied,Fast and Easy,Thanks/Praise
8/4/2022,Satisfied,"I found it confusing in how to order a book.  I had to read 'fine print' to realize I needed the item number.  Prior, I only had to click on the book to have it added to my cart.  I also wanted the drop down box to include giving the book to the teacher, but it only had the students.",Website Performance/Navigation
8/4/2022,Satisfied,more $1.00- $1.50 book options,Price
8/4/2022,Very Satisfied,Very clear directions and organization is wonderful.,Thanks/Praise
8/4/2022,Very Satisfied,I wish I could search by catalog when spending the bonus free $10,Website Performance/Navigation
8/4/2022,Satisfied,Still waiting on an order shipment to EDUCARE of Lincoln from June!,Delayed Shipping/Delivery
8/4/2022,Very Satisfied,Awesome site.  Gives enough info about the contents to help in the selection.,Thanks/Praise
8/4/2022,Very Disappointed,never received an email to recover password,Website Performance/Navigation
8/4/2022,Neutral,I wish you carried more of your Branches series online. I end up ordering from Amazon instead because they have a bigger selection. It also stinks when you can only buy books in packs from Branches. It is such a great set of books for my 4th graders who are EL and are still working on developing reading skills. They feel great reading a chapter book like peers. Just wish you had a bigger selection on the website.,Products Offered/Availability
8/4/2022,Neutral,Very disappointed with the huge increase in prices for most books.,Price
8/4/2022,Disappointed,"My account is tax exempt, but I was still charged tax.",Account Balance/Payment
8/4/2022,Very Disappointed,I'm not sure if my purchase was made or not. My daughter is Harlo and your asking me to connect the purchase to a child so I pick my daughter and then you send me to another page saying connect to the teacher etc I JUST WANT TO PURCHASE SOME BOOKS FOR MY DAUGHTER NOT STAY ON HERE PLAYING CONNECTION GAMES! LAST TIME I ORDERED IT WAS EASY I PLACED THE ORDER AND IT SAID ORDER PLACED.,Website Performance/Navigation
8/4/2022,Neutral,My granddaughter's teacher was not registered with Scholastic.  I spent an excessive amount of time chatting on the site to find out how to correct the problem.,Website Performance/Navigation
8/4/2022,Very Satisfied,Prices have gone up.  Missing the 10 for $10 packs.,Price
8/4/2022,Satisfied,Keeps signing out even when actively browsing and shopping.,Website Performance/Navigation
